{
    "$schema": "http://json-schema.org/draft-04/schema#",
    "additionalProperties": false,
    "definitions": {
        "module": {
            "additionalProperties": false,
            "description": "A module/Ein Modul",
            "properties": {
                "credits": {
                    "description": "ETCS credits/ETCS Credits",
                    "type": "integer"
                },
                "oral_exam": {
                    "description": "Did you participate in an oral exam because of you had not any exam tries left?/Hast du an einer mündlichen Prüfung teilgenommen weil du keine Klausurversuche mehr hattest?",
                    "type": "boolean"
                },
                "grade": {
                    "description": "Module or exam grade/Modul- oder Klausurnote",
                    "type": "number"
                },
                "name": {
                    "description": "Module name/Modulname",
                    "type": "string"
                },
                "number": {
                    "description": "Module number/Modulnummer",
                    "type": "number"
                },
                "participated_semesters": {
                    "description": "List of all semesters you participated this course/Liste an Semestern in welchen du dieses Modul besucht hast",
                    "items": {
                        "type": "integer"
                    },
                    "uniqueItems": true,
                    "type": "array"
                },
                "recommended_semester": {
                    "description": "The recommended semester/Das empfohlene Semester",
                    "type": "integer"
                },
                "weighting_factor": {
                    "description": "The weighting factor of the grade/Der Gewichtungsfaktor für die Note",
                    "type": "number"
                },
                "wrote_exam_semesters": {
                    "description": "A list of all semesters you wrote the exam/Eine Liste von allen Semestern in welchen du die Klausur geschrieben hast",
                    "items": {
                        "type": "integer"
                    },
                    "uniqueItems": true,
                    "type": "array"
                }
            },
            "required": [
                "name",
                "number",
                "credits"
            ],
            "type": "object"
        },
        "catalog": {
            "additionalProperties": false,
            "description": "A catalog/Ein Katalog",
            "properties": {
                "credits": {
                    "description": "The minimum ETCS credits you need from this catalog/Die kleinste Anzahl an ETCS credits welche man in diesem Katalog besitzen muss",
                    "type": "integer"
                },
                "name": {
                    "description": "Catalog name/Katalogname",
                    "type": "string"
                },
                "number": {
                    "description": "Catalog number/Katalognummer",
                    "type": "number"
                },
                "modules": {
                    "description": "Catalog modules/Katalogmodule",
                    "type": "array",
                    "items": {
                        "$ref": "#/definitions/module"
                    }
                }
            },
            "required": [
                "name",
                "number",
                "credits"
            ],
            "type": "object"
        }
    },
    "properties": {
        "$schema": {
            "description": "Pointer to the schema against which this document should be validated/Zeiger zu dem verwendeten Dokument welches nach diesem validiert werden soll",
            "title": "Schema",
            "type": "string"
        },
        "current_semester": {
            "description": "Your current semeser/Dein aktuelles Semester",
            "type": "integer"
        },
        "title": {
            "description": "The title of the document/Titel des Dokuments",
            "type": "string"
        },
        "start_year": {
            "additionalProperties": false,
            "description": "Your start year/Dein Startjahr",
            "required": ["year", "semester"],
            "properties": {
                "year": {
                    "description": "Your start year/Dein Startjahr",
                    "type": "integer"
                },
                "semester": {
                    "description": "Your start semester/Dein Startsemester",
                    "type": "string",
                    "enum": ["WS", "SS"]
                }
            }
        },
        "field_of_study": {
            "description": "Your field of study/Dein Studiengang bzw. -fach",
            "type": "string"
        },
        "matriculation_number": {
            "description": "The matriculation_number/Die Matrikelnummer",
            "type": "integer"
        },
        "modules": {
            "additionalProperties": false,
            "description": "Your modules/Deine Module",
            "properties": {
                "base": {
                    "uniqueItems": true,
                    "description": "Your base modules/Deine Basismodule",
                    "items": {
                        "$ref": "#/definitions/module"
                    },
                    "type": "array"
                },
                "core": {
                    "description": "Your core modules/Deine Kernmodule",
                    "uniqueItems": true,
                    "items": {
                        "$ref": "#/definitions/module"
                    },
                    "type": "array"
                },
                "key_qualifications": {
                    "description": "Your key_qualifications/Deine Schlüsselqualifikationen",
                    "uniqueItems": true,
                    "items": {
                        "$ref": "#/definitions/module"
                    },
                    "type": "array"
                },
                "supplementary": {
                    "description": "Your supplementary modules/Deine Ergänzungsmodule",
                    "uniqueItems": true,
                    "items": {
                        "$ref": "#/definitions/catalog"
                    },
                    "type": "array"
                }
            },
            "required": [
                "base",
                "core",
                "supplementary",
                "key_qualifications"
            ],
            "type": "object"
        },
        "name": {
            "additionalProperties": false,
            "description": "Your name/Dein Name",
            "properties": {
                "first_name": {
                    "description": "Your first_name/Dein Vorname",
                    "type": "string"
                },
                "surname": {
                    "description": "Your surname/Dein Nachname",
                    "type": "string"
                }
            },
            "required": [
                "first_name",
                "surname"
            ],
            "type": "object"
        },
        "needed_credits": {
            "description": "The needed ETCS credits/Die zu erreichenden ETCS Credits",
            "type": "integer"
        }
    },
    "required": [
        "matriculation_number",
        "current_semester",
        "field_of_study",
        "name",
        "start_year",
        "title",
        "needed_credits"
    ],
    "type": "object"
}
